<?xml version="1.0" encoding="UTF-8"?>

<!-- Doctype defines relevance to identified dtd structure with 'content' as a root element. -->
<!DOCTYPE content SYSTEM "../DTD/bradbury.dtd">

<!-- This associates XSLTs with xml. -->
<?xml-stylesheet type="text/xsl" href="../XSLT/bradburyBiography.xsl"?>
<?xml-stylesheet type="text/xsl" href="../XSLT/Coloured.xsl"?>
<?xml-stylesheet type="text/xsl" href="../XSLT/Miscellaneous.xsl"?>
<?xml-stylesheet type="text/xsl" href="../XSLT/ReadAll.xsl"?>
<?xml-stylesheet type="text/xsl" href="../XSLT/Stylistics.xsl"?>

<!-- Content consists of three stories. -->
<content>
    
        <story type="short story" title="The Pedestrian">
        <!-- 
            'header includes technical information which is either displayed (bibl) or hidden being empty (meta).
            'meta' inserts metadata which is a reference to document details. 'bibl' displays story's title, year (if mentioned) and author's name and surname.
        -->
        <header>
            <meta author="Olga Loboda"/>
            <meta module="INSTG037"/>
            <meta lecturer="Simon Mahony"/>
            <meta source="http://mikejmoran.typepad.com/files/pedestrian-by-bradbury-1.pdf"/>
            <bibl>
                <title level="a">The Pedestrian</title>
                <date>
                    <year>1951</year>
                </date>
                <author>
                    <persName type="author" who="Ray Bradbury">
                        <forename>Ray</forename>
                        <surname>Bradbury</surname>
                    </persName>
                </author>
            </bibl>
        </header>
        
        <!-- Text consists of paragraphs with dynamic content in it. The children of the tags related to tropes and figures of speech can't be predefined. -->
        <text>

            <p>
                <metaphor category="trope" device="stylistic">To enter out into that silence</metaphor> that was the city at eight o'clock of a 
                <epithet category="trope" device="stylistic" ref="evening">misty</epithet> evening in
                <date>
                    <month>November</month>
                </date>, to put your feet upon that buckling concrete walk,
                <metaphor category="trope" device="stylistic">to step over grassy seams and make your way, hands in pockets, through the silences</metaphor>, that was what 
                <persName type="character" who="Leonard Mead">
                    <persTitle>Mr.</persTitle>
                    <forename>Leonard</forename>
                    <surname>Mead</surname>
                </persName> most dearly loved to do.
                <reference type="anaphoric" to="Leonard Mead">He</reference> would stand upon the corner of an intersection and peer down long moonlit avenues of 
                sidewalk in four directions, deciding which way to go, but it really made no difference; 
                <reference type="anaphoric" to="Leonard Mead">he</reference> was alone in this world of 
                <date type="fictional">
                    <year category="AD">A.D. 2053</year>
                </date>, or as good as alone, and with a final decision made,
                <asyndeton device="stylistic" category="figure_of_speech"/>a path selected
                <reference type="anaphoric" to="Leonard Mead">he</reference> would stride off, sending patterns of frosty air before him 
                <simile category="figure_of_speech" device="stylistic">like the smoke of a cigar</simile>. 
            </p>

            <p>Sometimes
                <reference type="anaphoric" to="Leonard Mead">he</reference> would walk for hours and miles and return only at midnight to his house. And on his way
                <reference type="anaphoric" to="Leonard Mead">he</reference> would see the cottages and homes with their dark windows, and it was not unequal to 
                walking through a graveyard where only the faintest glimmers of firefly light appeared in flickers behind the windows. Sudden 
                <periphrasis category="figure_of_speech" device="stylistic">gray phantoms</periphrasis> seemed to manifest upon inner room walls where a curtain 
                was still undrawn against the night, or there were whisperings and murmurs where a window in a 
                <epithet category="trope" device="stylistic" ref="building">tomblike</epithet> building was still open. 
            </p>

            <p>
                <persName type="character" who="Leonard Mead">
                    <persTitle>Mr.</persTitle>
                    <forename>Leonard</forename>
                    <surname>Mead</surname>
                </persName> would 
                <enumeration category="figure_of_speech" device="stylistic">pause, cock his head, listen, look, and march on</enumeration>, his feet making no noise on the 
                <epithet category="trope" device="stylistic" ref="walk">lumpy</epithet> walk. For long ago
                <reference type="anaphoric" to="Leonard Mead">he</reference> had wisely changed to sneakers when strolling at night, because the dogs in intermittent squads 
                would parallel his journey with barkings if he wore hard heels and lights might click on and faces appear and an entire street be startled by the passing of a 
                <periphrasis category="figure_of_speech" device="stylistic">lone figure</periphrasis>, himself, in the early 
                <date>
                    <month>November</month>
                </date> evening. 
            </p>

            <p>On this particular evening 
                <reference type="anaphoric" to="Leonard Mead">he</reference> began his journey in a westerly direction, toward the hidden sea. There was a good 
                <metaphor category="trope" device="stylistic">
                    <epithet category="trope" device="stylistic" ref="frost">crystal</epithet> frost in the air;
                    <hyperbole device="stylistic" category="trope">
                        <reference type="anaphoric" to="frost">it</reference> cut the nose and made the lungs blaze</hyperbole> 
                    <simile category="figure_of_speech" device="stylistic">like a Christmas tree inside</simile>; you could feel the
                    <epithet device="stylistic" category="trope" ref="light">cold</epithet> light going on and off, all the 
                    <periphrasis device="stylistic" category="figure_of_speech">branches</periphrasis> filled with invisible snow
                </metaphor>.
                <reference type="anaphoric" to="Leonard Mead">He</reference> listened to the faint push of his soft shoes through autumn leaves with satisfaction, and 
                <onomatopoeia category="trope" device="stylistic">whistled</onomatopoeia> a cold quiet
                <onomatopoeia category="trope" device="stylistic">whistle</onomatopoeia> between his teeth, occasionally picking up a leaf as
                <reference type="anaphoric" to="Leonard Mead">he</reference> passed, examining its skeletal pattern in the infrequent lamplights as 
                <reference type="anaphoric" to="Leonard Mead">he</reference> went on, smelling its rusty smell. 
            </p>

            <p>
                <sp>"Hello, in there,"</sp> 
                <reference type="anaphoric" to="Leonard Mead">he</reference> 
                <onomatopoeia device="stylistic" category="trope">whispered</onomatopoeia> to every house on every side as 
                <reference type="anaphoric" to="Leonard Mead">he</reference> moved.
                <sp>"What's up tonight on 
                    <enumeration category="figure_of_speech" device="stylistic">Channel 4, Channel 7, Channel 9</enumeration>? Where are the cowboys rushing, and do I see 
                    <orgName>
                        <geogName>
                            <region type="country">the United States</region>
                        </geogName>Cavalry
                    </orgName> over the next hill to the rescue?" 
                </sp>
            </p>

            <p>The street was 
                <zeugma category="trope" device="stylistic">silent and long and empty</zeugma>, with only his shadow moving 
                <simile category="figure_of_speech" device="stylistic">like the shadow of a hawk</simile> in midcountry. If
                <reference type="anaphoric" to="Leonard Mead">he</reference> closed his eyes and stood very still, 
                <epithet category="trope" device="stylistic" ref="Leonard Mead">frozen</epithet>, 
                <reference type="anaphoric" to="Leonard Mead">he</reference> could imagine himself upon the center of a plain, a wintry,
                <asyndeton device="stylistic" category="figure_of_speech"/> windless
                <geogName type="desert">
                    <region type="state">Arizona</region>
                    <geogFeat>desert</geogFeat>
                </geogName>with no house in a thousand miles, and only 
                <periphrasis category="figure_of_speech" device="stylistic">dry river beds</periphrasis>, the streets, for company. 
            </p>

            <p>
                <sp>"What is it now?"</sp>
                <reference type="anaphoric">he</reference> asked the
                <metonymy device="stylistic" category="trope" ref="people">houses</metonymy>, noticing his wrist watch. 
                <sp>"Eight-thirty P.M.? Time for a dozen assorted murders? A quiz? A revue? A comedian falling off the stage?"</sp>
            </p>

            <p>Was that a 
                <onomatopoeia device="stylistic" category="trope">murmur</onomatopoeia> of laughter from within a moon-white house?